{"schema_version":"1.0.0-fixture","fixture":true,"operational":false,"overall_health":"YELLOW","authoritative_production_version":"V1","generated_at_utc":"2026-07-20T20:00:00Z","freshness_threshold_hours":24,"current_global_objective":"Complete Enigma R2 design while preserving V1 production","current_gate":"R2A Task 2C and GodView V2 preview review","next_gate":"Independent verification and fixture QA","unresolved_blocker_count":1,"verified_reconstruction_tests":42,"write_controls_allowed":false}